{
  "identity": {
    "id": "mida_cosma_pc1002",
    "brand": "MIDA",
    "model": "Cosma",
    "family": "pc1002",
    "oem": "PHNIX",
    "app": "AquaTemp",
    "also_sold_as": [
      "Azuro",
      "Mountfield"
    ],
    "verification": "verified",
    "source": "protocol-analysis/dumps/20260906_104432 + protocol-analysis/dumps/_oem_mida_cosma_BP6II-X_de.txt (MIDA.Cosma 13/20/28/35)",
    "connector": "RS-485 on the display/DTU bus"
  },
  "link": {
    "baud": 9600,
    "parity": "N",
    "stop_bits": 1,
    "slaves": {
      "0": "broadcast",
      "1": "panel",
      "2": "second UI",
      "99": "DTU"
    }
  },
  "driver": {
    "type": "pc1002_bus",
    "write_targets": [
      "slave2",
      "dtu_99",
      "panel_1"
    ],
    "default_write": "slave2",
    "power_also_write": [1014],
    "detect": {
      "fw_display": 713,
      "fw_main": 772
    },
    "broadcast": {
      "start": 2001,
      "qty": 90
    },
    "settings": {
      "slave": 1,
      "pages": [
        {
          "start": 1001,
          "qty": 90
        },
        {
          "start": 1091,
          "qty": 90
        },
        {
          "start": 1181,
          "qty": 90
        },
        {
          "start": 3001,
          "qty": 30
        }
      ],
      "idle_s": 0.05,
      "timeout_s": 0.8,
      "flags": {
        "reg": 3011,
        "bits": { "4": 1001, "16": 1091, "64": 1091, "32768": "all" }
      }
    }
  },
  "modes": [
    "heat",
    "cool",
    "auto"
  ],
  "enums": {
    "mode": {
      "0": "cool",
      "1": "heat",
      "2": "auto"
    },
    "power": {
      "0": "off",
      "1": "on"
    },
    "temp_unit": {
      "0": "celsius",
      "1": "fahrenheit"
    }
  },
  "registers": {
    "power": {
      "reg": 2011,
      "write": 1011,
      "type": "bool"
    },
    "mode": {
      "reg": 2012,
      "write": 1012,
      "prefer": "settings",
      "enum": "mode",
      "type": "enum"
    },
    "active_mode": {
      "reg": 2012,
      "enum": "mode",
      "type": "enum"
    },
    "setpoint": {
      "reg": 2013,
      "write": 1013,
      "scale": 0.1,
      "type": "i16"
    },
    "setpoint_cool": {
      "write": 1135,
      "scale": 0.1,
      "type": "i16"
    },
    "setpoint_heat": {
      "write": 1136,
      "scale": 0.1,
      "type": "i16"
    },
    "setpoint_auto": {
      "write": 1137,
      "scale": 0.1,
      "type": "i16"
    },
    "silent": {
      "reg": 2064,
      "write": 1076,
      "type": "bool",
      "nonzero": true
    },
    "silent_timer": {
      "write": 1072,
      "type": "bool"
    },
    "silent_timer_start_h": {
      "write": 1068,
      "type": "u16"
    },
    "silent_timer_stop_h": {
      "write": 1069,
      "type": "u16"
    },
    "timer1_on": {
      "write": 1158,
      "type": "bool"
    },
    "timer1_off": {
      "write": 1159,
      "type": "bool"
    },
    "timer1_on_h": {
      "write": 1150,
      "type": "u16"
    },
    "timer1_on_min": {
      "write": 1151,
      "type": "u16"
    },
    "timer1_off_h": {
      "write": 1152,
      "type": "u16"
    },
    "timer1_off_min": {
      "write": 1153,
      "type": "u16"
    },
    "timer2_on": {
      "write": 1160,
      "type": "bool"
    },
    "timer2_off": {
      "write": 1161,
      "type": "bool"
    },
    "timer2_on_h": {
      "write": 1154,
      "type": "u16"
    },
    "timer2_on_min": {
      "write": 1155,
      "type": "u16"
    },
    "timer2_off_h": {
      "write": 1156,
      "type": "u16"
    },
    "timer2_off_min": {
      "write": 1157,
      "type": "u16"
    },
    "t_inlet": {
      "reg": 2046,
      "scale": 0.1,
      "type": "i16"
    },
    "t_outlet": {
      "reg": 2047,
      "scale": 0.1,
      "type": "i16"
    },
    "t_ambient": {
      "reg": 2049,
      "scale": 0.1,
      "type": "i16"
    },
    "t_coil": {
      "reg": 2048,
      "scale": 0.1,
      "type": "i16"
    },
    "t_exhaust": {
      "reg": 2050,
      "scale": 0.1,
      "type": "i16"
    },
    "power_kw": {
      "reg": 2055,
      "scale": 0.1,
      "type": "i16"
    },
    "energy_24h_kwh": {
      "reg": 2057,
      "scale": 0.1,
      "type": "i16"
    },
    "comp_hz": {
      "reg": 2021,
      "type": "u16"
    },
    "fan_rpm": {
      "reg": 2067,
      "type": "u16"
    },
    "serial": {
      "reg": 2001,
      "type": "ascii",
      "count": 7
    },
    "fw_display": {
      "reg": 2089,
      "type": "u16"
    },
    "fw_main": {
      "reg": 2084,
      "type": "u16"
    },
    "outputs": {
      "reg": 2019,
      "bits": {
        "compressor": 0,
        "water_pump": 1,
        "four_way_valve": 2,
        "high_fan": 3,
        "low_fan": 4
      },
      "type": "bits"
    },
    "faults": {
      "regs": [2074, 2075, 2076, 2077],
      "type": "faults",
      "file": "_faults_pc1002.json"
    },
    "clock": { "reg": 3015, "count": 3, "type": "bcd_hms" },
    "t_suction": { "reg": 2045, "type": "i16", "scale": 0.1, "unit": "°C",
      "entity": { "platform": "sensor", "device_class": "temperature", "category": "diagnostic", "enabled": false } },
    "low_pressure": { "reg": 2054, "type": "i16", "scale": 0.1, "unit": "bar",
      "entity": { "platform": "sensor", "device_class": "pressure", "category": "diagnostic", "enabled": false } },
    "superheat": { "reg": 2060, "type": "i16", "scale": 0.1, "unit": "°C",
      "entity": { "platform": "sensor", "device_class": "temperature", "category": "diagnostic", "enabled": false } },
    "ac_voltage": { "reg": 2063, "type": "u16", "unit": "V",
      "entity": { "platform": "sensor", "device_class": "voltage", "category": "diagnostic", "enabled": false } },
    "dc_bus": { "reg": 2069, "type": "u16", "unit": "V",
      "entity": { "platform": "sensor", "device_class": "voltage", "category": "diagnostic", "enabled": false } },
    "phase_current": { "reg": 2022, "type": "u16", "scale": 0.1, "unit": "A",
      "entity": { "platform": "sensor", "device_class": "current", "category": "diagnostic", "enabled": false } },
    "ipm_temp": { "reg": 2023, "type": "i16", "scale": 0.1, "unit": "°C",
      "entity": { "platform": "sensor", "device_class": "temperature", "category": "diagnostic", "enabled": false } },
    "eev_steps": { "reg": 2020, "type": "u16",
      "entity": { "platform": "sensor", "category": "diagnostic", "enabled": false } },
    "antifreeze": { "reg": 2065, "type": "i16", "scale": 0.1, "unit": "°C",
      "entity": { "platform": "sensor", "device_class": "temperature", "category": "diagnostic", "enabled": false } },
    "t_coil_2": { "reg": 2072, "type": "i16", "scale": 0.1, "unit": "°C",
      "entity": { "platform": "sensor", "device_class": "temperature", "category": "diagnostic", "enabled": false } },
    "comp_hz_target": { "reg": 2085, "type": "u16", "unit": "Hz",
      "entity": { "platform": "sensor", "device_class": "frequency", "category": "diagnostic", "enabled": false } },
    "cop": { "reg": 2040, "type": "i16", "scale": 0.1,
      "entity": { "platform": "sensor", "category": "diagnostic", "enabled": false } },
    "capacity": { "reg": 2041, "type": "u16",
      "entity": { "platform": "sensor", "category": "diagnostic", "enabled": false } },
    "switches": { "reg": 2034, "type": "bits",
      "bits": { "high_pressure": 0, "low_pressure": 1, "flow_switch": 2, "remote": 3 },
      "entity": { "platform": "binary_sensor", "category": "diagnostic", "enabled": false } }
  },
  "service_menu": {
    "file": "_service_menu_pc1002.json"
  },
  "hz_max": {
    "heat": "h08_max_freq_heat",
    "cool": "h09_max_freq_cool",
    "default": {
      "cool": 55,
      "heat": 90,
      "auto": 90
    }
  },
  "fixtures": {
    "frames": {
      "power_off": "63 10 03 F3 00 01 02 00 00 30 F1",
      "power_on": "63 10 03 F3 00 01 02 00 01 F1 31",
      "mode_cool": "63 10 03 F4 00 01 02 00 00 31 46",
      "mode_heat": "63 10 03 F4 00 01 02 00 01 F0 86",
      "mode_auto": "63 10 03 F4 00 01 02 00 02 B0 87",
      "heat_setpoint_31c": "63 10 04 70 00 01 02 01 36 D8 44",
      "active_setpoint_31c": "63 10 03 F5 00 01 02 01 36 B1 11",
      "silent_on": "63 10 04 34 00 01 02 00 01 97 46",
      "silent_off": "63 10 04 34 00 01 02 00 00 56 86"
    },
    "dump": "protocol-analysis/dumps/20260906_104432"
  }
}
